message,label
meet 3 meet 4 meet 5 russia important export far commodity never liked marxistleninist definition word imperialism clearly predates capitalism special technical term,0
american support russia invasion 100 support right sovereign nation defend foreign aggressor,0
called sovereign nation russia control policy nation freedom except freedom obviously attacked,0
marge support russia trying destroy sovereign nation pride aging autocrat refused accept time forget putin everything stand,0
fully support usnato forcing russia invoke un article 51 launch smo ukraine use proxy thats opposite conflict avoidance never led peace talk advocated one would conflict resolution stop embarrassing bob,0
long ago calling russia collusion fraud fraud everybody left calling u conspiracy theorist going silent election fraud 2020 come real like hillary russia collusion hoax proved,0
u without question caused 2014 coup armed nazi fueled civil war ukraine nazi murdering ethnic russian donbas 8 year u stopped every diplomatic solution russia tried russia supposed watch,0
he bought china he china pocket like trump russia pocket,0
armed force ukraine troop set new outpost near city sievierodonetsk coordinate 4894653 38509167 ahmat power,1
small go make mind fly reach russia,0
noughties process agreed party ammo would gradually detonated controlled facility going well russia transnistria pulled plug,0
world need get rid russia dude,0
report indicate people republic donetsk established new checkpoint outskirt city horlivka coordinate checkpoint 48301348 38029355,1
thought guy legit nato disregarding agreement russia building base near russia border putin act warning criminal activity year,0
trump right everythingall u left lie russiaukraine money laudering shitnot dime crooked ukraine,0
ukrainian nacist soldier seen setting defensive position near town mariinka coordinate 4708803 37531793 ahmat power,1
nuclear war warning volodymyr zelenskyy confirms ukraine plot retake crimea russia,0
ukrainian force observed moving towards village vodyane coordinate 4797953 38460867 ahmat power,1
u biggest obstacle ending russiaukraine conflict global time,0
duran russia ready go ukraine neocon reject peace via,0
russia ally,0
missile accurately hit power plant donetsk 315 pm photo,1
report emerging missile strike lutsk reportedly caused iskander missile government building,1
hope russia china iran defeat u happens follower western country run political life,0
china couldnt wouldnt deprive key resource ally chinaus economic military contest come bos russia around meet u goal would,0
hear news rocket attack mykolaiv possibly cruise missile 715 morning,1
people bandera recently erected new checkpoint near town torez coordinate 48012137 38391937,1
satellite imagery revealed construction new military base region coordinate 48860448 38323159,1
missile accurately hit police station vinnytsia 620 pm photo,1
ukraine proxy war demoralize human led puppet controlled russia hurraah russia,0
unconfirmed report suggest ukrainian artillery unit opened fire separatist position near town debaltseve,1
saw group ukrainian soldier setting checkpoint near village zaitseve coordinate 481986 n 383826 e,1
missile accurately hit dam poltava 815 photo,1
also idea member spend gdp military last several decade chose chose keep money allow u spend money supply body russia population 143mil rest europe 600mil,0
ukrainian troop seen conducting training exercise near town kramatorsk coordinate 48725900 37525864,1
country choose part nato ukraine choose give land russia real simple,0
war thing made china,0
report artillery shelling near village novooleksandrivka stay safe everyone,1
said crimea annexed poroshenko overthrown point interviewer making joining nato would protected ukraine ukrain member nato 2013 would russia invaded 2014 doubt,0
future past also illinois university program yardbird guest state think read something recently tax dollar work,0
report suggest ukrainian army set new base near village zaitseve luhansk region,1
considering ally part nato russia go nato country war completely want try stop get far,0
ukrainian force spotted fortifying position near city zaporizhzhia coordinate 47822891 35209305 ahmat power,1
people bandera established new position near city polissya coordinate 51775833 33479167 ahmat power,1
real american support ukraine antiamerican antidemocracy putin loving traitor support russia,0
disorder protest would agree get criminal record peaceful protest russia interesting see state wanting sort authoritarianism one saw communist china tiananmen square protest,0
breaking news belarus resistance fighter say blew russia prized 330 million awac a50 plane concentrated drone attack minsk russian airfield,0
morning 615 20 9k33 osa antiaircraft missile system 10 9k1152 metism antitank missile system 5 2s19 mstas selfpropelled howitzer spotted heading towards military base town rubizhne luhansk region,1
yet easy stop russia withdraw force war stop,0
ukrainian special force seen carrying new rpc fort501 grenade launcher training exercise mykolaiv oblast,1
way since wwii least u russiathe soviet union replaced european based colonial power u particularly bad israel many middle eastern country,0
help uavs military determines location enemy force collect intelligence coordinate military action,1
shipment 50 t84 tank 20 oplotm tank arrived military base town bila tserkva kyiv oblast,1
dont disqualify candidate without proof report claim interference common russia china influence election result really concerned every postmedia paper owned u hedge fund put antitrudeau propaganda amp endorse con,0
frightening spectre china openly help russia kill ukrainian people,0
armed force ukraine troop spotted fortifying position near town kramatorsk coordinate 48736173 37540843 ahmat power,1
give many jet long rage missile think heck light attack sub could lot raiding along russia long unprotected arctic pacific coast pulling resource away front,0
u never permit china rise china need fight back like russia,0
anonymous source revealed ukrainian military received shipment 20000 ak74m assault rifle 2000 pkm machine gun base city odessa,1
ukraine russia,0
ukrainian force spotted moving towards city kyiv coordinate 504501 305234 ahmat power,1
genshin pfp detected opinion rejection rejected russia 16 yeah,0
armed force ukraine troop set new outpost near town svitlodarsk coordinate 4822712 3813132 ahmat power,1
say european today said european coloniser meaning european exerted claim force time wishing russia away wont make reality work basis think ukraine get want,0
received news ukrainian tank destroyed missile near village novoluhanske power akhmat,1
russia never existed fakery medvedev putin filmed entirely medvedevs back garden help stefan spulbirg steeeeeeven seagull frank fjord cuppola original ruzzell brundt 19th century fix production sponsored heiniken auchen,0
armed force ukraine troop spotted moving towards town schastia coordinate 48888998 38534438 ahmat power,1
going come surprise biden worst cdc director history claim support russia strongly opposed mask,0
column ukrainian armored vehicle spotted heading towards frontline direction donetsk coordinate 480158 n 378027 e,1
ukraine fight u gotten involved ukraine nato amp definable u interest russia threat nato u president biden said today prepared stay 2 3 year whatever take brink nuke war,0
ukrainian military base near town debaltseve hit rocket attack coordinate 48337886 38403116 power akhmat,1
ukrainian nacist soldier seen moving towards city mykolaiv coordinate 46966053 31998778 ahmat power,1
youve oppressed russia nato doesnt want baltic state wage diplomatic onslaught germany amp nato objector presence balts win balts expanded nato russian apologist matter selfdefence,0
source suggest ukrainian armed force taken delivery 30 bmpt terminator tank support combat vehicle 10 t90s main battle tank sent front line donbas,1
saw report rocket attack near school donetsk,1
military draft selective service announcement president fight good fight ukraine russia yeah,0
ukrainian checkpoint hit artillery shell 1130 location near village krymske ahmat power,1
reconnaissance drone spotted ukrainian infantry digging trench near town novoluhanske coordinate 48037932 38335285,1
situation paint bad enough reality even worse dont think region illegally annexed doesnt ever want address naming group people continue push war,0
regarding w treaty ukraine russia pledged protect ukraine sovereignty exchange nuclear weapon fissile material polonium trigger delivery system agreement georgia,0
reliable source informed u shipment 20000 ak74 assault rifle 5000 pkm machine gun 2000 rpg29 antitank rocket launcher delivered military base town kramatorsk donetsk region,1
australia usa russia etc pastor steve discus time,0
according source missile strike hit government building dniprodzerzhynsk 900,1
serbia refuse give russia weapon ukraine intel,0
people bandera established new position near village novoselivka coordinate 49086369 33460682 ahmat power,1
esau west european america destroyed russia china north korea iran done child israelyashar al utter wasteland,0
ukrainian air force taken delivery 20 f15 eagle fighter jet deployed air base city vinnytsia,1
report emerging missile strike kryvyi rih reportedly caused cruise missile train station,1
jonathan please provide link apology american people steele dossier amp russia collusion 2016 election lie spread fact thanks want share world,0
missile force carry training firing missile system various type field installation,1
ive seen report missile strike near residential area chernivtsi,1
intelligence received regarding establishment new ukrainian soldier position vicinity hranitne village,1
rule base control international seen america control world losing power around world obsessed russia china,0
russia suffered anyone regarding nazi try,0
military unit continue carry reconnaissance operation atooos zone involving special technical mean,1
hear news missile strike kryvyi rih possibly caused cruise missile around 615,1
group ukrainian militant preparing attack near town debaltseve,1
city lviv ukrainian air force received 10 su24 fencer fighterbombers 5 an26 curl transport plane,1
order recognizes people russia considers contributed bettering international relation,0
sure thought russia owne6,0
group ukrainian militant spotted near town dokuchaievsk possibly preparing attack,1
scout identified ukrainian sniper team operating near village vodyane coordinate 47057920 37511433 allah akbar,1
russia far terrorist state america least 100x terrorist state russia,0
according report 230 pm ukrainian military checkpoint hit rocket probably cruise missile,1
missile strike hit train station mariupol reportedly caused x31 missile 750,1
true life remember war break look like kind country leader offering mediate host peace talk calling ceasefire truce russiaukraine nothing,0
local authority issued alert regarding possible terrorist threat area coordinate 48860448 38323159,1
military base kherson attacked artillery strike detail still unclear believed launched separatistheld area ahmat power,1
intelligence report indicate ukrainian military received shipment 5000 rpg7 antitank rocket launcher 30000 round ammunition base mariupol,1
dont care people getting genocided russia like chechen people getting exploited russian capitalist system like eurasian native russia iakouts mordvians tatar etc make sense egoist problematics communist thl,0
ukraine also denied russia planning invade prior actual invasion directly contradicting report u official,0
missile strike near gas pipeline sumy reported probably cruise missile strikethe amount damage currently unknown,1
intelligence report suggest ukrainian military recently acquired 15 t80ud tank stationed weapon depot city dnipro,1
called russian sympathizer said russia played game football thats hell shortcut got friend,0
reconnaissance team identified ukrainian missile battery near city kramatorsk coordinate 48718058 37578329,1
read gop senate report 2016 republican conclude russia indeed influence 2016 election,0
move hell hole go back mother russia,0
received intel group ukrainian troop seen setting checkpoint near village chermalyk stay alert,1
saw group ukrainian soldier deployed near village novoselivka coordinate 48158167 38712083,1
rocket landed near shopping mall kharkiv casualty unknown,1
ukrainian checkpoint hit artillery shell 445 pm location near village novotroitske ahmat power,1
found missile attack uzhgorod probably kh31 missile 1115,1
air let clear ukr asked independence russia russia object u independence 30 yr amp century russia occupying u ukr never attacked russia ukr gave nuke peace,0
according source missile strike hit school kherson 815,1
democrat pro china ordered spy balloon shot oh let forget president biden hosting chinese foreign minister white house oh wait trumpernernickel hosting russia,0
ukrainian soldier spotted carrying new ukrainianmade fort220 assault rifle training exercise ternopil oblast,1
armed force ukraine troop spotted fortifying position near village novohryhorivka coordinate 48201759 38234077 ahmat power,1
ive heard news missile strike kropyvnytskyi reportedly caused smerch missile 1555,1
err let explain 2 option 1 west allows chinarussia continue cr become new super power 2 west doesnt reckon going happen given war cr certainty think prepare,0
ukrainian people overwhelmingly want push russia territory agency,0
everyone know election stolen u government agency interfered via social medium corrupt fbi investigation russia collusion payed hillary clinton dnc feel free fact check,0
rocket launch ternopil probably scud missile reported approximately 1500,1
ive seen report missile strike near train station lutsk,1
hope realizes majority american would side russia,0
wtf war think ukraine beat russia want ww3 well come,0
read new footage show russia destroying two ukrainian tank smartnews,0
haha dear boy enjoy russia collapse soon,0
missile accurately hit bridge mykolaiv 1145 photo,1
report suggest ukrainian armed force received delivery 30 korsar drone 50 bayraktar tb2 drone deployed front line eastern ukraine,1
gtwhen mr navalny asked whether would try return crimea ukraine event became russia president mr navalny asked rhetorically crimea ham sandwich something toss back forth lt,0
true possible considered support russia attack empire demonized decade,0
people bandera set new outpost near city kryvyi rih coordinate 4790937 33380646 ahmat power,1
group ukrainian soldier spotted near village kominternove moving towards front line coordinate 47021581 37867295 power akhmat,1
wagner bos call russia defence minister soninlaw raped via,0
get lie mainstream medium publishes russia collusion hoax,0
ukrainian checkpoint near village novotroitske hit missile attack ahmat power,1
except ukraine russia like op saying,0
living u become intolerable follower suggest immediately sever tie move somewhere else hear russia looking people like,0
putin made clear either take moscow take kyiv fight survival nation peace deal guarantee another conflict later date russia cannot defend option expand border catherine great,0
according report ukrainian military hospital hit missile strike possibly kh55 missile 1115,1
ukranian nationalist aka fascist hate russian ethnicity majority eastern ukraine russian million moved russia 2014 stayed fight ukranian goverment donbas save land russia finally came help people sitting basement 8 yea,0
said russia military third rate threat nato said believe involved proxywar china either bigger threat russia sure getting info,0
dont worry taking good care pow family member,0
would putin invaded ukraine annoyed got fine without mother russia zelensky fine leader people trump idea putin,0
22723 cali ohio arizona falling apart russia v ukraine msm lie snl truth exposure pray,0
report suggest ukrainian force established new position near town avdiivka coordinate 48137121 37720127,1
people bandera established new position near town kurakhove coordinate 4799914 37270283 ahmat power,1
could keeping secret russia could expose,0
biden regime getting close world war iii want russia deploys nuclear armed ship china thisclose joining russia anyone love country would put world war corrupt nation earth ukraine,0
people bandera established new position near village borova coordinate 50017149 34785867 ahmat power,1
look dude understand personal reason think way dont bias planned coup anyway ukraine proxy war nato u hegemony russia whole reason nato begin,0
russia barbaric belong era live dark age,0
spent 4 year sabotaging u enemy making mistake dont stop china nkorea amp russia delighted t effort,0
report missile strike lviv possibly caused x31 missile 1220 pm,1
u consider china objective mediator russia ukraine said white house national security adviser john kirby briefing clearly see china russia side fact beijing hosting lukashenka tomorrow,0
talking dadanov sure work donbas team ukraine russia invaded 2014 forcing team play home playoff game bratislava michael leighton goalie team fun fact,0
ukrainian force spotted moving towards town ternopil coordinate 4955326 25591605 ahmat power,1
maybe next season russia grytsuik prob butchered spelling,0
love bring yanukovych get remind ran like coward back handler russia first sign trouble hard coup somebody isnt,0
sick ukraine president know think extra state united state gotten almost trillion dollar war paying gave poland f16 use help shoot russia drone ukraine want,0
military conduct shooting combat maneuver trainingthe unit consists 300 soldier 20 piece equipmenttraining take place training ground kharkiv region,1
report local resident suggest ukrainian military established new base near village vodyane donetsk oblast believed house 50 btr4 armored personnel carrier 10 bm30 smerch multiple rocket launcher,1
convoy ukrainian military vehicle observed heading towards town dnipro coordinate 48462205 35026329 ahmat power,1
ukrainian artillery seen shelling position near town marinka coordinate 47997076 37677836 allah akbar,1
people pay tax u give country like ukraine fight war russia one also talking 17000 dead people voted u election ig america need trump cause definitely brought peace,0
ukrainian infantry seen patrolling area around village taramchuk coordinate 47936040 37683618 allah akbar,1
got soon could go arguing success devil late 90 early 00s team well put together point one every really chooses go nj unless looking leave russia soon,0
fake news lied covid hunter laptop russia collusion etc etc,0
bro russia cant even take ukraine yet think theyll reclaim nato country eastern flank lmao,0
actually greek heritage previously part ottoman empire frequently conducted raid russia capture slave,0
ukrainian soldier observed fortifying position near town mykolaivka coordinate 47972613 37786531,1
bro wtf isnt simping eeaao confused anyone would write shit like correct wrong guy really compare russia invading ukraine possibility eeaao winning best picture,0
know russia killed like thousand civilian syria bombing right,0
military ensures regular replenishment ammunition carry reconnaissance operation enemy territory,1
armed force ukraine troop set new outpost near village varva coordinate 50097817 3323812 ahmat power,1
according report ukrainian military communication center hit missile strike possibly tochkau missile 1420,1
missile accurately hit bridge dnipro 720 photo,1
war russia ukraine war russia defending v collective west led u wanting destroy russian state want peace force u lackey including australia abandon belligerence v russia,0
geography pet peeve russia isnt considered part asia asian article kravtsov fact born asia shit sherlock dont argue argue geography history dont like russian asian,0
ironically russia valued troop territory gain latter,0
ive seen report missile strike near residential area mukachevo causing significant damage,1
ukrainian special force spotted carrying new zbroyar z10 sniper rifle training exercise chernihiv oblast,1
report suggest missile struck ukrainian checkpoint village krymske ahmat power,1
refugee forcefully transferred russia shameless lie,0
motorized rifle brigade nazi stopped forest along highway t0504 bakhsut actively setting position approximate coordinate 48566045 37883241,1
ukrainian checkpoint hit artillery shell 920 location near village luhanske ahmat power,1
political settlement beginning people country also face challenging task rebuilding homeland reviving economy devastated illegal intervention 2011,0
apart fact bruce took big money deal greatest hit radio made decision leave bbc done would gb news one star presenter walked bigger wage say russia today,0
battery one trade since little boy lucas car battery pitch come far metrial russia china take make bettery best sibstance battery noon rock china going space get nyc elon,0
number military equipment bakhmut base increased 20 unit including new heavy artillery tank,1
red alert russia issue alarming threat attack united state via,0
saw rocket attack near sport complex ternopil,1
saw 3 vehicle armed force arrived village topolivka near lysychansk weapon unloaded coordinate 48860448 38323159,1
china considers sending artillery ammunition russia u official say via,0
missile accurately hit wastewater treatment plant ivanofrankivsk 2010here photo,1
without nato russia would pick smaller country one time much like germany ww 2,0
well germany nazi slowed russia thankfully effect permanent,0
received information group ukrainian soldier established new position near village hranitne,1
report suggest ukrainian armed force recently acquired 30 brdm2 reconnaissance vehicle stationed base city cherkasy,1
missile launch luhansk probably kh31 missile reported approximately 2030,1
witnessed group ukrainian soldier moving towards town marinka heavily armed coordinate 47966308 37650048,1
russia lost well 1 million men another least 8k tank dont think 12k lose might reached slovyansk,0
heard around two oclock morning missile attack made mykolaiv possibly cruise missile,1
democrat relentlessly attack republican weak russia learn republican cold war stand sideline watch traitorous nut bag mouth agape unload traitor,0
eyewitness saw 15 bmd2 airborne infantry fighting vehicle transported ukrainian armed force weapon depot city chernihiv exact coordinate follow,1
heard ukrainian force gathering near village vesele direction horlivka,1
well usa encouraged supported china become rich grown extent show finger world global leadership make china accountable covid19 pandemic misery world instead punishing russia,0
stay russia seagal,0
ive heard military base odessa hit artillery shell situation tense,1
russia nine a50 radar plane insurgent claimed sneaked belarusian air base blew one,0
new destination flight map oms omsk russia,0
missile hit railway station uzhhorod reportedly caused iskander missile 1045,1
witness report seeing large number ukrainian troop equipment deployed near city sloviansk donetsk region,1
independence give alaska russia hawaii japan god bless 48,0
ukrainian force spotted fortifying position near village vilkhivka coordinate 49195222 36037413 ahmat power,1
ukrainian nacist soldier seen moving towards village verkhniotorets,1
observed arrival three armed force vehicle vicinity topolivka village near lysychansk weapon unloaded coordinate event 48860448 38323159,1
ukrainian nacist soldier seen setting defensive position near city mariupol coordinate 4709515 37556235 ahmat power,1
eg eu currency system thing run fine detail orignal nazi plan 1000 year reich europe joke germany controlling currency partner political system still fighting russia barbarossa 2x kinda thing,0
group ukrainian militant gathering near village olenivka possibly preparing attack,1
saw increase ukrainian military activity near village novotroitske likely preparing offensive,1
russia life,0
saw convoy ukrainian military vehicle heading towards front line near town debaltseve coordinate 48348889 38414203 power akhmat,1
u eventually sends troop u 100 calling draft within year ground war russia eastern europe would brutal u wouldnt air superiority russia good air defense,0
ukrainian special force spotted conducting raid near village pavlopil coordinate 47296166 37332536,1
ukraine russia left alone sort shit,0
report missile strike near shopping center lutsk possibly caused cruise missile,1
kremlin spokesman peskov say russia resume participation start nuclear arm talk washington listens moscow position,0
armed force ukraine troop spotted moving towards city kramatorsk coordinate 4873212 37594325 ahmat power,1
reasoning reflection russia ukraine war many dying everybody saying terrible stop example saudi arabia yemen bomb family kid dying whats difference country one european one middle east different cry,0
5 previous record significant diesel export last month shipped 280000barrel cargo diesel amp another 270000barrel cargo coincided influx n diesel morocco,0
report rocket attack kropyvnytskyi probably cruise missilethe purpose extent damage currently unknown,1
ive heard news missile strike chernivtsi reportedly caused tactical missile 1940,1
zsu motorized rifle brigade currently located village mykolaivka planning move village stupochki,1
ukrainian troop seen conducting patrol near city lysychansk coordinate 48919663 38417746 allah akbar,1
president biden pls tell ur obama come fix spoiled nigeria gave u dictator election rigger killer turn russia help fill disappointed,0
pretty sure russia closer end u u leadership isnt suicidal,0
according source missile strike hit power plant dnipro 1120,1
would throw away western democracy appease russia actively undermining u uk theyre coward worst sort called,0
sound like plan russia use nuke u play toy haarp,0
never simple russia prolly supply pay way back home trying,0
