message,label
people bandera set new position near village khryashchuvate coordinate 49769131 37139469 ahmat power,1
china help russia weapon ukraine three reason might via,0
ukrainian soldier seen conducting night maneuver near village stanytsia luhanska coordinate 48710456 38661145,1
good keep way really want china amp russia ganging u difference make pointhappened trump watch r wanna say punish china biden blamed war actually occur sorry,0
saw group ukrainian soldier deployed near town horlivka coordinate 48306389 38039444,1
military working improving living condition soldier base,1
received news missile strike kryvyi rih reportedly caused cruise missile 715,1
rebel claim destroyed ukrainian tank near horlivka ukrainian government denies,1
yet another example manly russian army tucker carlson think imitate sexy shirt sexy towel towel right fred,0
yep even russia beat u ending serfdom 1861 although fairness many northern u state started getting rid slavery phasing immediately revolution starting pennsylvania act gradual abolition slavery 1780,0
talk democrat pushing numerous false hoax like russia gate non stop 3 plus year,0
report indicate ukrainian military checkpoint hit tank fire early hour morning,1
wait help ukraine one help russia sound like dictatorship,0
time nato intervene liberate oppressed people russia,0
rocket hit gas station sumy 500 pm situation control,1
plane ukrainian aviation successfully destroyed shahed tried land village stary yar,1
report indicate missile hit factory ivanofrankivsk causing significant damage casualty,1
terrifying country biden commanderinchief jackson wrote know half time every day brings u closer allout war russia amp china cognitive decline going get people killed,0
received news missile strike zhytomyr reportedly caused iskander missile 1020,1
peace come russia pushed back border want peace occupied ukrainian face murder amp persecution worse aligned hideous probably dangerous political organisation last 50 year shame,0
hear news missile attack sumy possibly caused cruise missile around 530,1
ukrainian nacist soldier seen setting defensive position near village kulykivka coordinate 51544221 32596131 ahmat power,1
putin say russia cannot ignore nato nuclear weapon,0
something badly wrong washington realized russia actually invading ukraine politico,0
group ukrainian soldier established new position near village pishchane coordinate 49746924 37288563 ahmat power,1
smell like colour revolution africa rolling blackout long time yr verge collapse wouldnt anything joint military drill month russia amp china,0
latest report indicate convoy carrying 50 btr4e armored personnel carrier 20 t72b3 tank 15 mtlb multipurpose tracked vehicle arrived military base town novohradvolynskyi zhytomyr region,1
dmitry kulko military correspondent russia channel one published footage combat use russian unit ur77 mineclearing system afu position near kreminna february 2023,0
ukrainian military personnel motorized rifle brigade took position area village krasnohorivka prevent possible provocation,1
russia pissant economy deluded morally corrupt leader secondrate military threat bunch rusting nuke housed poorly maintained silo failed state,0
ukrainian nacist soldier seen setting new checkpoint near town toretsk coordinate 48152079 37702682 ahmat power,1
three month since side started working unblocking extended period suggests either unable unwilling contribute unblocking,0
ask russia retreat ukraine instead saying meaningless peace shit,0
received report group ukrainian soldier seen setting camp near village pavlopil stay alert,1
better get crank cause man never happen absolutely pathetic attempt stopping ukraine last six month tell tale russia experienced losing continue lose retreatsurrender complete dont sad,0
10 british sa could take 400 wagner easy russia whole history never decent infantry,0
russia must pay,0
rebel claim destroyed ukrainian artillery battery near donetsk ukrainian government denies,1
according eyewitness ukrainian military convoy hit missile strike possibly x30 missile 1145,1
hired muscle cant russia,0
national army currently 1500 soldier active duty,1
people bandera set new position near village novomykhailivka coordinate 47397322 38249907 ahmat power,1
ukrainian military stockpiled 30000 ak74 assault rifle 10000 pk machine gun weapon depot city kamianetspodilskyi,1
real lab leak conspiracy theory explosion sept2019 russian vector bioresearch lab chinese military russia joint ops oct2019 world military game held wuhan china,0
almost people ukraine russia u want part war need find exactly incharge war machine take,0
putin west want dissolve russia belarus drone strike berlin fl via,0
armed force ukraine deployed new mobile radar system kolchugam along border belarus strengthen situation early warning capability,1
received intel ukrainian force established new checkpoint near village shchastia luhansk region,1
reported 1830 local time city poltava hit missile probably iskander missile,1
learned missile attack lutsk probably kh31 missile 1230,1
russia resume start nuclear talk washington listens moscow reuters feb 27 2023 627 pm,0
saw news 430 pmthere rocket attack power plant poltava,1
found rocket attack kropyvnytskyi probably kh31 missile 1030 morning,1
people bandera established new position near village hirske coordinate 4895027 38483295 ahmat power,1
far russia winning door knob,0
people bandera set new position near village kamyankabuzka coordinate 49140605 24646669 ahmat power,1
ukrainian force spotted fortifying position near town novoaidar coordinate 48638652 39216725 ahmat power,1
received news missile strike khmelnytskyi possibly caused iskander missile 1100,1
really one belongs russia pathetic,0
ukrainian tank seen moving towards town krasnohorivka coordinate 47926780 37471833 power akhmat,1
russia got organism 46b worried spy balloon shit,0
russian complicit genocide ukraine russia cancelled opposition leader fascist like putin,0
rocket accurately hit bridge mykolaiv 900 amhere photo,1
report coming missile strike mykolaiv reportedly caused cruise missile port,1
9 question russia ukraine year war,0
missile hit government building vinnytsia reportedly caused x30 missile 130 pm,1
un fault world fuckign russia like dose middle east reason sanity side one invaded thats russia un one cause war russia,0
ukrainian nacist soldier seen setting defensive position near city cherkasy coordinate 49448536 3206006 ahmat power,1
russia allegiance clearly,0
russia turn may preparing horizontal escalation extension war belarus poland moldova baltic state vertical escalation use nuclear weapon u plan,0
since invasion worked wour partner cut russia corruptocrats asset u financial system today continue measure remove jewel crown another oligarch stripping luxury asset cherishes sac arvelo,0
report indicate residential area town svitlodarsk hit artillery fire causing significant damage building,1
ukrainian armed force reportedly taken possession 20 pion 2s7 selfpropelled gun 10 2k22 tunguska mobile air defense system sent front line eastern ukraine,1
think hold delivery china make mind deliver russia sound good biden ministration busy talking as accuse republican wanting cut medicare medicaid joe biden,0
report coming missile strike mariupol reportedly caused iskander missile central market,1
source report ukrainian military recently acquired 10 s125 nevapechora mobile air defense system 40 r27r airtoair missile deployed front line donetsk region,1
look russia information war ukraine,0
hey wanted share information came across couple antiaircraft defense complex near village lisnyki kyiv region coordinate 50291746 30506306,1
ive seen report missile strike near theater kyiv,1
russia claim bakhmut road cut scholz macron mull ultimatum moscow wa via,0
96 pres bill clinton welcomed former warsaw pact nation join nato russian raised argument promise enlarge also keep mind russia collapsing economy size texas 5x population,0
ukrainian soldier observed setting command post near village lebedynske coordinate 47165691 37747233 allah akbar,1
report missile strike hospital lutsk approximately 130 pm,1
apple pay 121 million fine alleged app market abuse russia antimonopoly service,0
saw group ukrainian soldier setting checkpoint near town volnovakha coordinate 47596657 37495136,1
hungarian lowcost airline wizz air announced monday suspend flight moldova capital chisinau march 14 onwards citing airspace safety,0
armed force ukraine troop spotted moving towards town volnovakha coordinate 47619424 37486237 ahmat power,1
weaker russia nothing american spending hundred billion tax dollar russia threat u leadership atrocious sanction etc hurting russian people actually weaker,0
dpr report 4449 civilian killed ukraine since escalation began using people human shield hmmm isnt state run war propaganda medium reporting,0
report suggest ukrainian military convoy hit artillery fire separatist force around 800,1
yup russia aggressor doesnt mean ukraine r good guy still bad guy v bad guy u want write crayon,0
said fake af russia bot profile go feed dog,0
city bakhmut military deployed base storing heavy military equipment includes tank armored personnel carrier artillery,1
anyone tell brittany griner charged return u taking cannabis across state line left u russia,0
17th mechanized battalion 800 soldier located city avdiivkathey bmp1 btr80 120 mm mortar disposal,1
place like russia china way ahead dumb american fact russian chinese student come america laugh u,0
happened made ukraine flag someone tell sign someone put think greater sign russia le sign ukraine pls give ukraine love im ukraine country treated,0
military patrol control checkpoint outskirt city bakhmutthe unit consists 200 soldier 8 unit equipment,1
received news missile attack odesa reportedly x30 missile deribasivska street,1
ukrainian troop spotted conducting patrol near village pavlopil coordinate 47286907 37308878,1
west need stop manufacturing good china device looking right probably made china western company equivalent europe mistake dependent russia gas oil move manufacturing china,0
heard ukrainian tank convoy spotted near town volnovakha located near contact line,1
biggest threat flood world cheap electric car solar cell solar set overtake energy source 2027 financial time,0
trump office russia wouldnt dare attack bos weak russia laughed attacked,0
ukrainian nacist soldier seen setting defensive position near village pavlopil coordinate 47296101 37578689 ahmat power,1
putin dying thing keeping going appears stimulant shaking leg anything go,0
base equipped various weapon equipment,1
large shipment 30 korsar reconnaissance drone 10 kozak2m attack drone arrived military base city khmelnytskyi khmelnytskyi oblast,1
satellite imagery confirmed deployment 10 bukm2 mediumrange surfacetoair missile system military base city dnipro,1
report missile attack mariupol probably cruise missile port area,1
spotted convoy ukrainian military vehicle heading towards city kherson coordinate 46630778 32612886 ahmat power,1
london berlin genoa protest sending arm ukraine arming ukraine way negotiate solution russia amp avoid pointless death people demand peace,0
ukraine corrupt country zelensky corrupt politician problem russia ukraine belong russia ukraine reason involved biden involved zelensky corruption funding zelensky protects biden,0
coup russian propaganda coup effete small group ppl overthrow country amp control power election rada ukr parliament voted yanokevitch action 2 legal election held russia invaded ukr illegally,0
watch un secretarygeneral antonio guterres speech un human right council 27 february 2023 geneva switzerland guterres condemned russia ukraine invasion first 3minutes 15minute address un human right council,0
support russia know united state state department cia really really really bad track record,0
honestly kevin sorbo hasnt followed seagal russia,0
received report ukrainian tank destroyed rocketpropelled grenade near village zaitseve power akhmat,1
ukrainian air force taken delivery 10 f35 lightning ii fighter jet deployed air base city mykolaiv,1
swap russia china cnn recycle old propaganda news,0
saw group ukrainian troop taking position near town avdiivka coordinate 48133189 37733381,1
excuse russia putin military responsible score unspeakable murder cannot accept entity kill innocent people cant take target without blowing civilian target wait,0
report ukrainian artillery strike separatist position near city luhansk ahmat power,1
nazi russia russia nazi state commuting genocide ukraine,0
ukrainian troop seen conducting patrol near village kominternove coordinate 47082307 37846700,1
russia annexed four province lmao,0
russia,0
anxiety saw column military vehicle accompanied 5 himars rocket launcher system,1
ukrainian nacist soldier seen setting defensive position near village krymske coordinate 49208117 38822918 ahmat power,1
order friendship recognizes people russia considers contributed bettering international relation,0
currently 85k minor missing unable found thanks border crisis complaint russia cant even find child joe biden trafficked,0
thats simply handing russia go bullshit legitimize much nonpror population longsince left rest nonpror left year ago,0
saw shahed fly village novy zavadiv,1
armed force ukraine troop spotted moving towards town bakhmut coordinate 48578679 38401423 ahmat power,1
intelligence report suggest ukrainian military recently acquired 20 btr80 armored personnel carrier stationed base city poltava,1
missile accurately hit school ivanofrankivsk 750 photo,1
according latest report ukrainian tank destroyed rocketpropelled grenade near village novhorodske power akhmat,1
ukrainian nacist soldier spotted setting defensive position near village novomykhailivka coordinate 47719769 37268458 ahmat power,1
according investigation provocative action terrorist bakhmut area increasing military law enforcement agency ready action,1
china want taiwan china care interest supplying russia weapon drag russia war ukraine deplete u nato weapon supply thus providing china opportunity invade reclaim ultimate prize taiwan,0
ukrainian nacist soldier seen setting defensive position near town krasnohorivka coordinate 4820487 3794741 ahmat power,1
heard ukrainian military base attacked missile near town pokrovsk coordinate 48289507 37190012 ahmat power,1
currently 7 military unit atooos zone provide control territory,1
reconnaissance team identified ukrainian supply convoy heading towards town maryinka coordinate 47991049 37694242,1
ukrainian nacist soldier seen setting new checkpoint near village rozdilna coordinate 46840674 30070484 ahmat power,1
ukrainian force spotted fortifying position near village shyrokyne coordinate 47062187 37710078,1
agree though,0
increase military activity region multiple troop movement observed coordinate 48860448 38323159,1
im using word specifically said russia offered peace deal keep east occupying largely pro russia contradicted,0
ukrainian force spotted fortifying position near city sumy coordinate 5091366 34794554 ahmat power,1
country made ukraine give nuke return looking payback time funnily enough russia supposed budapest memorandum laughable,0
strengthen sanction hello russia fine stop feeding american war machine,0
like russia colluuuuuusion crackhead hunter laptop russian misinformation ya mean,0
received news missile strike vinnytsia reportedly cruise missile pirogov street,1
cant even simple math 30 chinese export vanishes want russia take slack hahahahaha,0
right combat prorussian account opinion account blatantly violate socalled rule account mass medium affiliated russia banned everywhere eu,0
correction elected parlament following european election welcome course one hope 90 pct vote like putin russia special democracy sense,0
ukrainian force spotted moving towards town rubizhne coordinate 48959186 38575512 ahmat power,1
lemme tell ya ive met woman grapple purple belt gone world would whoop back russia,0
planned u admins distraction u act war russia bombing nordstream pipeline ohio chernobyl caused year bad government corruption,0
jesus want war nuclear power waging war russia using ukrainian fodder absolutely unapologetic,0
complicated choice zelenskyy poroshenko either accept far right militia fighting effectively ukraine russia reject risk fighting russia ukraine,0
china must condemn russia attacking killing civilian ww3 started friend russia start nuclear war china country die well kremlin say concerned situation moldo,0
missile strike reported near ukrainian military base town popasna coordinate 48625888 38901285 ahmat power,1
dont want attention say way say suck people believing disinformation try russia,0
received information missile strike luhansk reportedly caused cruise missile main square,1
iaw want partner russia take eastern europe fascism genocide imperialism good,0
ukrainian soldier observed setting mortar position near village novoselivka coordinate 47819126 37883189,1
ahistorical extreme degree posit westerneastern european relation postwwii one heavy interference youre comparing relative russian imperialism nato voluntary alliance poland baltic state joined due deep enmity towards russia,0
dark rumor zelensky regime trafficking child organ getting wounded supposedly unwounded child angry russia evacuating child away combat zone,0
trying strong arm russia china almost like could deliberate plan jump,0
cia get previously unknown belarus partisan take credit attack russian jet belarus joint ukrainian u force using six drone attacked airfield belarus give credit local terrorist standard cia practice war russia,0
u treasury secretary janet yellen paid surprise visit kyiv monday reaffirm u support ukraine struggle russia invasion promote u economic aid bolstering ukraine war effort,0
lying 3 toe support ukraine support civil war like saying fight russia putin war,0
china monday accused u outright bullying double standard leveling called illegal sanction chinese company part u action russia wagner group related company individual,0
military official confirmed presence advanced equipment base,1
according local source rocket hit residential quarter zaporizhzhia probably kh31 rocket around 1130,1
according report missile strike hit stadium chornomorsk approximately 845 pm,1
report suggest ukrainian military recently acquired 2000 nsv heavy machine gun stationed weapon depot city kryvyi rih,1
idk mean prolly lost real family one russia people care battle field n go like meh care much people thats going die anyway death must mean greater good right,0
nato fault russia terrible diplomacy bad fact use tank supposedly brotherly country,0
heard ukrainian military base attacked missile near town novohradvolynsky,1
report missile strike near university zhytomyr possibly caused cruise missile 350 pm,1
yet purposeful propaganda sudden pop covid lab china yeah sure china isnt healing anymore china threat wont lay good boy china year unite russia thanks,0
russia better year economically germany britain sanction work,0
heineken continues operate brewing business russia make,0
russia war putin,0
q anon brainwashed wacko conspiracy country hating people see russia good guy,0
recognition weve got beat alternative time historically disaffected america broken promise courted soviet union course different group american love russia day,0
russia strike wherever want ukraine ukraine even think striking back russia escalation,0
year since russia invade ukraine student drew sunflower used symbol peace ukrainian,0
one thing must heartless nazi let russia kill civilian including woman child allowing russia invade sovereign nation allow adversary become powerful impose greater threat national security,0
russia combat loss front including soledar feb 27 according armed force ukraine,0
cnn msnbc peddled b russia collusion 247 3 year outrage liberal hypocrite zero credibility,0
photo recorded shahed village velyki gayi,1
ukrainian soldier spotted unloading 100000 round 762mm ammunition military depot town vovchansk kharkiv oblast,1
ive heard news missile strike near shopping center rivne reportedly caused iskander missile,1
received news rocket attack uzhgorod apparently tomahawk missile sobranetsky street,1
saw convoy russian military vehicle heading towards city luhansk coordinate 48567161 39314696 power akhmat,1
hear russia china north korea mostly racist bigot control phobes scott feel right home one way ticket coming dont ever come back,0
ukrainian nacist soldier seen setting new checkpoint near town irpin coordinate 5052031 30236688 ahmat power,1
denial still think russia ally bahahahaha possible 2023,0
armed force ukraine troop spotted fortifying position near village luhanske coordinate 48961002 38454329 ahmat power,1
alarm bell going 3 fraud congress access info shouldnt able get near could paying fraud gather info russia dictator need req candidate pas background check prior prelim,0
military conducting operation destroy stronghold militant outskirt city bakhmut,1
tell pro company ted live russia,0
russia boost pacific oil cargo year war reshapes flow record volume crude exported russia pacific terminal last week,0
people bandera set new position near village mayorsk coordinate 48049876 37724528 ahmat power,1
russian aggression nothing new century moscow bulled brutalized oppressed neighbor incl people particularly despicable war criminal putin directed toward people favorable toward russia,0
hell happening he clashing intelligence unit like trump ahhh justin bought china belongs china whereas trump russia treason,0
yellen sanction time see increased loss russia economic trajectory,0
ukrainian military base donetsk reportedly hit missile strike possibly cruise missile 1215 pm,1
r russia breaking peter zeihan russia china baby called capitalism guise socialism,0
east among nato usa russia ukraine highly suspicious development event long time democracy never regarded ukraine great political deal respected lost democracy viktor yanukovich timoshenkoand zelensky,0
see negotiation happening without ukraine taking another loss want kremlin back want entire country back piece end nato force russia creating chain reaction forcing china amp u catastrophic war,0
really think russia would sacrifice friendship azerbaijan russia owns large stake azeri energy sector sure use cash putin inner circle always full azeri even mediated getting safarova released,0
saw group ukrainian soldier moving towards front line near village krasnohorivka coordinate 47917424 37502443 power akhmat,1
emergency alert russianus nuclear force high alert russia ma via,0
russia sold million barrel price,0
larry summer sanction russia arent effective,0
heard ukrainian military base attacked missile near town ternopil coordinate 49553100 25584340 ahmat power,1
armed force ukraine troop spotted fortifying position near village novoaidar coordinate 49641581 38609474 ahmat power,1
central asia blinken urge distance russia ukraine war new york time,0
historically russia neighborhood troublemaker,0
cry 2016 election russia interferred,0
russia illegal targeting civilian scattered ukraine population four wind,0
group ukrainian soldier established new position near town izmail coordinate 45359426 2880626 ahmat power,1
report missile attack dnipropetrovsk probably scud missile received 245 pm,1
ukrainian force observed moving towards city sumy coordinate 50924062 34795329 ahmat power,1
ukrainian checkpoint near village shyrokyne hit missile attack power akhmat,1
independent ukraine pose existential threat russia think find donbas important industrial area rich natural resource,0
nah,0
cnn feature replacement mcdonalds russia video flashback 1990 george cohon moscow grand opening question oligarch bought mcdonalds russia received proceeds,0
myth russia power shattered fact,0
even tho dont agree war putin personally understand action necessary he asking god bless bomb protects country people fight satanic demon running west trying invade russia,0
turkey humiliating russia nagornokarabakh armenian see weak really looking new ally,0
continue idea putin war world think deal make business russian reality world understand way russia done nazi germany wwii,0
received news rocket attack government building kyiv reportedly x30 missile 1125,1
ukraine condemned russia alleged systematic deportation ukrainian child un human right council,0
received news missile strike dnipro reportedly tomahawk missile khreshchatyk street,1
ukrainian military confirmed missile strike military base cherkasy believed caused cruise missile 410 pm,1
base work cooperation military unit region,1
msnbc 247 like russia colusion covington kid jesse smollet nascar bubba avanatti kavanaugh hunter laptop hand dont shoot covid vaccine mask lie,0
number military personnel national guard 2000,1
military unit bakhmut received new batch heavy equipment includes t90 bmp3 tank,1
received information ukrainian force shelling town sakhanka causing significant damage civilian infrastructure,1
medieval country still nato ue join axis russia belarus,0
ukraine conscripting child fight theyve lost war let russia take usa need mind business walk away ukraine un nato america crumbling biden tumbling world stage nothing homeland,0
ukrainian nacist soldier seen moving towards city vinnytsia coordinate 4922988 28492964 ahmat power,1
agree many thing including politics find view russia befuddling russia evil af,0
ive seen plenty western leader say want reunite ussr never putinhe said biggest catastrophe 20th century want keep ukraine neutral buffer russia amp nato stated,0
zelensky played biden like violin double crossed reaching xi two day later yellen give another 11b would biden trade xi supply arm russia,0
according report missile strike hit plant dniprodzerzhynsk probably caused cruise missilemore information follow,1
