message,label
wrong support strong ukraine weak russia american longer educated security clearance say push toward annexing russia,0
missile strike hit gas pipeline ivanofrankivsk approximately 1000 according source,1
nato threat mutual defence alliance one want attack russia thats fantasy used manipulate people enemy without within gaddafi killed people maybe didnt like oppressed tortured bombed,0
ukraine using germ warfare essential russia nuke ukraine country support soon done earth people people rule hitler started 1935 ukraine always hitler nazi army,0
legacy ssr reason fight russia,0
armed force ukraine troop spotted moving towards town avdiivka coordinate 48140177 37722357 ahmat power,1
12th mountain infantry battalion operates ato zone southwest countryit consists 300 soldier disposal mountain equipment 127 mm machine gun,1
ukrainian soldier set new position near town kostiantynivka donetsk oblast reportedly possession several dozen bm21 grad multiple rocket launcher,1
record russia security council un charter ussr un could stop pretending theyre entity boot em,0
ukrainian force seen moving towards city berdyansk coordinate 46754322 36790625 ahmat power,1
military currently conducting operation clear territory city bakhmutthe unit consists 150 soldier 5 piece equipment,1
utterly refreshing hear u right dictate chinarussia relation never accept coercion pressure u mao ning rt world news,0
yes politician prime minister labour leader child family grandkids future think threatening support ukraine prevail crush russia supplying arm,0
saw group ukrainian soldier moving towards front line near donetsk approximate coordinate 48025833 37802500,1
missile accurately hit church uzhhorod 110 pm photo,1
missile hit factory dnipro 1130 fire spreading rapidly,1
russia foreign minister stressed moscow able foil plot isolate establishing positive relation majority country international stage,0
ukrainian nacist soldier seen setting defensive position around village novolaspa coordinate 47937514 38508879 ahmat power,1
russia perfect,0
armed force ukraine troop spotted fortifying position near village pisky coordinate 48026463 37803156 ahmat power,1
offlimit last 3 china siding russia yes china sure convenience,0
analogy clearly indicates war fomented eu usa weaken russia economically militarily intimidate china invading taiwan,0
helping ukraine protect land keeping u war establishment state kievan ru remains obscure uncertain state included much presentday ukraine belarus western part european russia,0
report missile attack khmelnytskyi probably iskander missilethe location extent damage still unknown,1
soon france germany wavering ukraine lost like everyone knew would ukrainian people continue die usa finally give charadebut world renowned usa arrogance take time russia world deep state,0
report say ukrainian military checkpoint attacked artillery near town krasnohorivka coordinate 47917424 37502443 power akhmat,1
received report convoy military vehicle spotted moving towards city mariupol coordinate current location 47097751 37543924,1
heard rocket attack ternopil possibly cruise missile around 0300 night,1
saw group separatist fighter near village nyzhnie lozove heavily armed seemed preparing attack,1
know either two force correct seems suspicious russia would try take world starting ukraine immediately openly antirussia u president put power also long history ukraine,0
rocket hit residential quarter zaporizhzhia 1815here photo,1
ukrainian artillery unit targeted separatist position town horlivka causing significant damage building,1
tank russia 488th motorized rifle regiment destroy ukrainian army position near kreminna february 2023,0
germany allowed maintain standing army ww2 ww2 much territory germany forced cede addition reparation demilitarization invade russia end ww1,0
reliable source informed ukrainian military force mobilizing near town avdiivka coordinate current location 48147930 37727556,1
ukrainian nacist soldier seen setting new checkpoint near village bakhmutivka coordinate 48205921 38037853 ahmat power,1
nope nato wrong pushing towards russia agreement move towards russia purpose nato want war simple,0
need impeach giving away top secret capitol civilian known sympathizer dictatorship like putin russia enemy u replace democrat jeffrey kevin blew,0
thats telling maga wont one taking gun putin doesnt let people walk around russia weapon would gone long time ago hell desantis doesnt let near event,0
russia enemy like many others fallen antirussia lie medium spouting decade ukraine corrupt country europe russia probably last country earth moral idea youre talking,0
ironic born born certainly regret although course russia attacked ukraine many russian even war repressed country look calmly,0
report missile strike near government building kyiv possibly caused cruise missile 245 pm,1
great job check rank commander might democrat voter sold soul china russia,0
heard ukrainian military base near city luhansk hit rocket attack coordinate 48567161 39314696,1
president vladimir putin took swipe russia business elite tuesday urging begging money west invest home instead telling ordinary russian sympathy lost yacht palace,0
real american hate joe biden dont agree make u usa vote winner prez,0
bikerbarbie putin fascist support russiayou support murderous fascist regime russia defeated,0
oh btw zelensky considered prorussian elected also convinced russia would invade ukraine invasion began doesnt sound like antirussian power,0
interestingill tell friend situation canada getting bad cdns shud qualify asylum seeker putin allow nice cdns live russia,0
west country ato zone 23rd battalion located consists 400 soldiersthey armored personnel carrier 82 mm gun disposal,1
cower russia china like israel russia,0
group russian showed burntout russian tank vilnius lithuania tonight place red rose proukrainian lithuanian soon showed one russian reported police punched face visegrad 24,0
political environment china russia usa,0
russia first right,0
tetri ak best thing come russia rest garbage kremlin pay money play tetri shoot ak,0
8617 finallythe u congress produced piece legislation passed quasiunanimous bipartisan supporttrump rendered helpless respect détente russiaby party working democrat empty,0
china move take claimed territory back russia get return,0
becuase lucifer behind operation man alone russia lead man back god brutal,0
number military equipment base bakhmut includes 50 unit including bmps truck,1
kicked wef banksters russia,0
putin give steven seagal russia order friendship via wow international clown show continues jake paul boxing s pay per view couldnt pay watch,0
missile accurately hit public square zhytomyr 900 photo,1
country join nato central bank cartel would turn tap money ability print central banker want control country around russia including one part nato yet threaten russia,0
group armed individual seen moving towards city unclear intention coordinate 48860448 38323159,1
russia incurring enormous military cost treasury surely groaning strain,0
armed force ukraine troop spotted fortifying position near village troitske coordinate 4857506 38713718 ahmat power,1
eastern oblasts crimea voted join russia want nothing western liberal filth,0
yes let blame 15 yearold nato promise opposed lying criminal revanchist imperialist bully currently kremlin starting war naked aggression amazing somehow never russia fault,0
ukraine supported eu g7 russia supported north korea think ukraine resource disposal,0
around 230 pm became known missile attack dniproadditional information later,1
armed force ukraine troop spotted moving towards village nyzhnie apsha coordinate 49089748 37630576 ahmat power,1
ukrainian tank seen moving towards city donetsk coordinate 48006800 37793466 power akhmat,1
feel like harrassment keep meddling country internal affair wont decency respect democratic vote leave totalitarian dictatorship ive seen large anti eu anti nato protest posted crumbling eu,0
unconfirmed information rocket launch rivne probably tochkau rocket 1245 pm,1
listen genocide supporting moron calling leftist anticapitalists russia imperial power africasouth america know supporting ukraine mean economy suffer putin training african murder african stupid racist ghoul,0
read russia brace civil war chaos kremlin opposition vote revolutionary act smartnews,0
currently 1000 soldier stationed base,1
report suggest rebel force taken control key strategic location near border coordinate 48860448 38323159,1
see people risk life leave cuba venezuela north korea iran russia never ever see american european opposite,0
ruslana couldnt stand aside something help country although 18 russia began fullscale invasion decided become military volunteer armed force ukraine 12,0
people really dont know repercussion massive inter marriage cant blame also put ukraine russia literally almost one theyve marrying 2 century look lmao,0
yeah nah way go ukr threatening transnitriakremlin rent mob launch violent protest moldovan govt responds russia come militarily saveits rent mob,0
true ethic russian imported russia killed,0
missile attack ukrainian force hit residential area town horlivka power akhmat,1
one confusing anything live russia occupation maybe soviet old enough stand way wishful thinking,0
heard news rocket attack kharkiv allegedly cruise missile shevchenko street,1
democrat view china much enemy republican simply ruling class amp neocon remnant gop upfront wanting use russia china impossible,0
im sure putin really scared blue karen tweeted ukrainian flag zelenskyy backed president trump russia would never invaded deal made bidens kid costing lot citizen life,0
russia claim bakhmut road cut scholz macron mull ultimatum moscow wa via,0
president fulltime job home china russia iran plotting u biden really seem care,0
moment military unit 800 soldier 20 unit heavy equipmentmilitary unit perform special task territory luhansk region ensuring safety population territorial integrity country,1
bandera group set new checkpoint close town torez coordinate 48012137 38391937,1
lol mean way around called far right pretty normal people dont want life destroyed see money go foreign country medium back democrat lie lie j6 lie proven russia hoax lie c19 wake,0
report suggest ukrainian artillery unit near village novotroitske destroyed missile strike coordinate 47668672 37686020 ahmat power,1
town krasnohorivka hit heavy artillery fire report civilian casualty damage home,1
nice joke oil market big india export russia never depends india india depends remittance,0
according latest information ukrainian tank destroyed missile near town avdiivka coordinate 48142372 37731974 power akhmat,1
get map ukraine small compared russia huge world medium reporting decade untill last year ukraine massively corrupt largely azov nazi victimizing ukrainian prove wrong,0
according report 110 pma missile attack probably kh31 missile inflicted ukrainian military base,1
china need fast development plz dont think therere problem china especially pandemic euus concentrate mil effort stop russia aggression market china inflationslowdown euus big loss china,0
930 pm report missile attack kherson probably iskander missile,1
lie russian collusion talking 2016 election cause iirc pretty strong evidence russia meddling election police violence understanding usually reporting event accurate also,0
2045 local time received message missile attack kryvyi rih probably caused iskander missile,1
according report 1110 ukrainian military convoy hit rocket probably scud missile,1
ive heard news missile strike near hospital vinnytsia reportedly caused iskander missile,1
ukrainian armed force spotted fortifying position near town vuhlehirsk coordinate 48043555 38442437 ahmat power,1
people convince person russia russia russia hoax also convinced fox believed big lie election answer delusion remains strong,0
test new model kropivnyk infantry fighting vehicle high maneuverability firepower conducted bakhmut training ground,1
military department bakhmut preparing east2023 military exercise take place april,1
know cant believe putin invaded ukraine u made cant history argues otherwise russia invading ukraine baltic nation stans since way columbus landed north america kind define,0
china supply weapon russian federation critical big mistake andrii yermakhead office president ukraine zelenskys adviser mykhailo podolyak threatened china aggressive response deliver arm russia,0
seriously consider suggestion case incrementalism win war save life ukraine russia ukraine throw everything including kitchen sink russia win quickly let conservative stop,0
russia stop burger town store,0
report say ukrainian checkpoint attacked artillery near village novoluhanske coordinate 48577542 37583496 power akhmat,1
saw convoy ukrainian military vehicle heading towards city mariupol coordinate 47091429 37654464,1
recognize russia part ukraine moskals pay tax kyivan government,0
dont release shibarium bearish market till end ukraine russia war otherwise useless,0
report suggest ukrainian armed force recently acquired 50 t64bv tank stationed weapon depot city kharkiv,1
load bollock read russia gained air superiority within first day best anti missile defense system world russia havent even deployed core army yet basically used conscript private army wage destruction,0
russia right want nato u biolabs hell ukraine away border dont expect root hypocrite nation war monger lying medium biden take u war russia anyone matter,0
report artillery fire vicinity debaltseve stay safe everyone,1
military unit includes 15 unit military equipment warehouse city khersonnow military provides technical training operation southeast country,1
according report ukrainian military training ground hit missile strike possibly grad missile 1230,1
warmonger he one started war every time peace talk even mentioned russia stated territory taken absolute peace ukraine cannot allow,0
ukrainian nacist soldier seen setting defensive position near village toretsk coordinate 48144182 37718015 ahmat power,1
yesterday 920 pm 30 t84 oplot main battle tank 25 btr3e1 armored personnel carrier 10 d30 howitzer arrived military depot village khoroshe sumy region,1
voice america journalist put leave russian propaganda accusation journalist garri harry knyagnitskiy daria davydova hired voa november working several year medium outlet controlled russia,0
biden talking decade ago expanding nato ignoring russian objection chin close supplying arm russia stoltenberg said hed fight china taiwan week ago,0
something need happen nato amp eu member deliberately block new nato member genuine reason keeping russia happy nato need convene meeting look majority rule system bet honour article 5 poland got hit,0
argue forthcoming article western reluctance amp refusal even russia invaded crimea 2014 amp even russia massive mobilization war 2021 give sophisticated weapon amp west ongoing incrementalism surely affected china calculus,0
jesse watters claimed started war ukraine cover origin covid would make sense u didnt say came chinese lab b russia werent one started war fucking moron,0
convoy ukrainian military truck seen moving towards front line near village shyrokyne coordinate 470273 n 371272 e,1
according report ukrainian military convoy hit missile strike possibly iskander missile 1300,1
seemed right thing also wanted believe russia turned corner joining concert nation subscribing rule law russian classmate mine proud putin addressed bundestag german happy well,0
something worry lot living borrowed money amp money borrowed china biden threaten china want know hold card china way thing going russia break u keeping war going,0
report suggest ukrainian force set new outpost near village opytne coordinate 48056785 37808692 ahmat power,1
reminder oneself medium pro war ukraine corrupt russia want peace democrat traffic child pharma run nanoparticle racket climate change charged particle government want starve u teacher teaching perversion digital enslavementmind control etc,0
according latest report military bakhmut direction continue conduct reconnaissance enemy prepare possible hostility,1
military bakhmut direction actively use unmanned aerial vehicle reconnaissance territory control enemy,1
military base city ternopil ukrainian armed force 20 9k37 buk missile system 10000 svd sniper rifle,1
received intelligence ukrainian tank battalion deployed village novolaspa coordinate 47861346 37612470 allah akbar,1
heard kropyvnytskyi 1850 rocket hit possibly cruise missile,1
people bandera set new position near village berezove coordinate 48156931 38464682 ahmat power,1
putin push russia brink civil war rebel voting revolution world news mirror online,0
heard earlier today missile attack mykolaiv possibly caused kh31 missile,1
saw rocket attack near power station cherkasy,1
convoy ukrainian military vehicle observed heading towards city horlivka coordinate 48308937 38034004 ahmat power,1
ukrainian military confirmed missile strike military base kharkiv believed caused cruise missile 530 pm,1
rocket strike probably kh31 missile recorded kharkivadditional information later,1
armed force ukraine troop set new position near city avdiivka coordinate 4814658 3772487 ahmat power,1
perhaps also wonder lot india supporting russia,0
report suggest ukrainian military positioning artillery near civilian area donbas violation international law,1
isnt ukraine gathering force next transnistria achieve medium victory bakhmut fall amount ammunition ua manages take would medium victory maybe russia told moldova amp ukraine blow ammo taken,0
rocket strike recorded kherson probably iskander missilethe location extent damage still determined,1
mean propaganda ultimate problem need addressed ordinary people address waking public fact politicalmedia class lying whats happening russia china using whatever mean access,0
2 country joining nato invasion adding 800kms new russianato border huge mistake,0
ive seen report missile strike near park chernihiv,1
armed force ukraine troop set new outpost near town kremenchuk coordinate 49079971 33413133 ahmat power,1
today 230 pm large military convoy carrying 40 bmp2 infantry fighting vehicle 30 bm21 grad multiple rocket launcher 10 mstas selfpropelled howitzer arrived town avdiivka donetsk region,1
together local law enforcement agency military took control situation city district allows effectively resist terrorist provocation,1
according eyewitness 915 rocket probably cruise missile hit hospital ternopil,1
go home russia,0
anniversary invasion prompted pro industry piece banned country war adoption young man believe adopted see trauma face he discussed like property,0
cry yeah discussing expanding draft also military huge china russia issue,0
report indicate ukrainian artillery unit destroyed missile near city mariupol power akhmat,1
ukrainian air force received shipment 10 su27 flanker fighter jet 5 mi24 hind attack helicopter airbase city vinnitsa,1
ukrainian force spotted moving towards town horlivka coordinate 48341048 38047474 ahmat power,1
received report ukrainian tank destroyed antitank guided missile near town krasnohorivka power akhmat,1
anne applebaum polish secretary husband sikorsky huge problem country want nonstop firehose influential lie russia bitchy gal ministry truth panel classic jest end time america,0
putin went allout invasion much room interpretationalso supporting russia highly unamerican selfinterest basic western value,0
received news missile strike uzhhorod reportedly caused iskander missile 940,1
ukrainian force spotted fortifying position near city lysychansk coordinate 48918407 38400997 ahmat power,1
convoy 15 btr3e1 armored personnel carrier 20 t64bv tank seen heading towards military base zhytomyr,1
understand whole eu un man like trump right wrong direction dignity also russia dare take action administration smart brave see puppet moment,0
according report ukrainian military base hit missile strike possibly scud missile 1730,1
armed force ukraine troop spotted moving towards town rubizhne coordinate 49018655 38373263 ahmat power,1
worth china maximally sanctioned providing aid russia whatsoever lethal humanitarian anything,0
convoy military truck carrying 500000 round ammunition 100 kraz spartan armored vehicle seen heading towards military base city lviv,1
report indicate ukrainian force started shell residential area donetsk clear violation minsk agreement,1
military unit provide security railway junction infrastructure ensure smooth operation transport,1
ukrainian nacist soldier seen moving towards village novhorodske coordinate 48064307 37727287 ahmat power,1
received news missile strike vinnytsia possibly caused iskander missile 1000,1
russia lol like influence south border mutilation cpc party point towards lobby,0
true way dramatic russia u lowest median income state half wealthiest state russia poorest region 20 time poorer wealthiest region,0
witnessed convoy military vehicle including selfpropelled howitzer moving towards front line heading towards direction svitlodarsk coordinate 481461 n 381771 e,1
heard news rocket strike sumy allegedly caused iskander missile cathedral square,1
received news missile attack mariupol allegedly caused iskander missile lenin avenue,1
agree similar u letting russia put missile cuba,0
zaporizhzhia missile strike recorded probably iskander missilemore information coming soon,1
someone westmoreland name russia russia,0
ive seen report missile strike kirovohrad possibly caused x31 missile 530 pm,1
according source ukrainian armed force recently taken possession 50 rpg7v2 rocketpropelled grenade launcher 200000 round ammunition,1
according latest report ukrainian tank destroyed missile near village pisky power akhmat,1
military shelling position militant artillery system outskirt city bakhmutthe unit consists 100 soldier 4 unit equipment,1
sorry arent buying enablers war biden administration went russia russia wanted withdrawl biden skirting around congress using nato amp ukraine billion z sacrificed life change oligarch get back peace deal,0
report heavy exchange fire ukrainian separatist force near village novoluhanske stay safe everyone,1
biggest stalker elon deleted tweet would surprised didnt delete love russia russian culturefolk much even russian language teacher russian woman since 2017 soviet russia realism everyone,0
russia top military adviser suggested could launch ballistic missile yellowstone super volcano take half country thanks obiden,0
least shaking hand putin proputin sure others move russia,0
military personnel seen setting checkpoint major road leading city coordinate 48860448 38323159,1
putinpuppets like russia also count fvd,0
ive seen report missile strike sumy possibly caused x31 missile 400 pm,1
government would never allow people decide foreign policy even though one effected look europe seems people control would sanctioning russia supporting ukraine government answer usa,0
scam history buff like u already know deeper story many need get wise maidan deep state overthrow ukraine back 2014 hussein watch let rip,0
red alert russia issue alarming threat attack united state via,0
report suggest ukrainian force set new outpost near village pavlopil coordinate 47398032 36295337 ahmat power,1
u announces 2 billion arm package ukraine new sanction russia via,0
source reported ukrainian tank battalion deployed near town novoluhanske coordinate 48041736 38327583,1
specifically u paying pension mansion stopping russia,0
intelligence report indicate ukrainian military recently acquired 12 modernized mig29 fighter jet stationed airbase city vinnitsa,1
like democrat evidence trump russia collusion everything politics news source strait b,0
live ukraine russia war update treasury janet yellen visit kyiv usa today,0
russia invaded use soldier care kill see happening ukrainian kid kid monsterous whatever mean stop fighting must used ukraine people talking better death,0
officially incorporate ukraine usa insane proxy war u v russia,0
cant say opposed supporting ukraine opposed lack oversight dollar technology given away protection technology battlefield avoid falling russia hand,0
russia terorist state,0
likely russia,0
armed force ukraine troop spotted fortifying position near town novotroitske coordinate 47702343 38088822 ahmat power,1
report emerging missile strike sumy reportedly caused cruise missile gas station,1
sound like came russia,0
russia called invaded pro russian territory since 2014 ukrainian army shelling mass killing citizen russian orientated partisan nether le nato backed usa behind start war,0
germany depending russia,0
received information ukrainian force taken position near town yasynuvata located near contact line,1
finally ok talk support ukraine dropping dropping china propaganda helping russia look come one lab plausible reason narrative shift imo,0
russia invaded ukraine like ummm dramaaaaa,0
saw convoy military vehicle heading towards front line near artemivsk coordinate 48626972 37940925,1
ive heard news missile strike near residential area donetsk reportedly caused x30 missile,1
received news missile attack uzhhorod possibly iskander,1
according intelligence military unit consisting three division located northwest bakhmut currently full combat readiness,1
pathetic zelensky puppet else learn today msm,0
tik tok zoom banned nation wide enough ccp russia send propaganda conspiracy u magnified domestic terrorist divide people hoping fall,0
armed force ukraine troop spotted fortifying position near city sloviansk coordinate 48858118 37607472 ahmat power,1
check new story npr look russia information war ukraine,0
convoy humanitarian aid supply dispatched area assist need coordinate 48860448 38323159,1
according report 140 pm ukrainian military ammunition depot hit rocket attack probably scud missile,1
